"id","text","answer","category_id","timesend","bonus","img"
"1","Собака плывет против течения реки. Определите скорость собаки относительно берега, если её скорость относительно воды 0,4 м/с, а скорость течения реки 0,3 м/с. Ответ дайте в м/c.","0,1","1","2022-09-12 08:01:01",,
"2","Велосипедист ехал из пункта А в пункт Б со скоростью 18 км/ч. Обратная дорога оказалась в гору, и он ехал вдвое медленнее. Какова средняя путевая скорость велосипедиста за всё время движения? Ответ дайте в км/ч.","12","1","2022-09-08 21:51:45",,
"3","Тело движется равноускоренно и прямолинейно. За три секунды модуль скорости тела увеличился от 3 до 12 м/с. Определите ускорение тела. Ответ дайте в м/с^2.","3","1","2022-09-11 20:01:01",,
"4","Тело движется c ускорением, постоянным по модулю и направлению. За первые три секунды движения скорость тела увеличилась от 3 до 11 м/с. Какой путь при этом прошло тело? Ответ дайте в м.","21","1","2022-09-17 08:01:01",,
"5","По графику зависимости проекции скорости от времени определите проекцию ускорения тела в интервале 1 до 1,5 с. Ответ дайте в м/c^2.","-8","1","2022-09-13 08:01:00",,"https://ons.ort.ru/botphizika/teacher/uploads/1661876966.jpg"
"6","По графику зависимости проекции скорости от времени определите модуль ускорения тела в интервале 0 до 0,5 с. Ответ дайте в м/c^2.","8","1","2022-09-11 08:01:01",,"https://ons.ort.ru/botphizika/teacher/uploads/1661877531.jpg"
"8","По графику зависимости проекции скорости от времени определите модуль скорости тела в момент времени 3с. Ответ дайте в м/c
","6","1","2022-09-10 08:01:01",,"https://ons.ort.ru/botphizika/teacher/uploads/1661877681.jpg"
"9","Улитка проползла 8 м строго на север, а затем 6 м строго на запад. Определите модуль перемещения улитки в метрах.","10","1","2022-09-29 20:01:01",,"https://ons.ort.ru/botphizika/teacher/uploads/1661878183.jpg"
"10","По графику зависимости проекции скорости от времени определите путь, пройденный телом за первые полсекунды движения. Ответ дайте в м.","1","1","2022-09-12 20:01:00",,"https://ons.ort.ru/botphizika/teacher/uploads/1661878523.jpg"
"11","Два камня подбросили вертикально вверх с поверхности Земли. Один из них достиг высоты 5 м, а другой - высоты 7 м. После этого камни упали на Землю. Определите, на сколько различаются пройденные камнями пути. Ответ дайте в метрах.","4","1","2022-09-10 20:01:01",,
"12","В начальный момент времени тело движется по окружности радиусом 3 м. Чему равен путь, пройденный телом, в момент, когда перемещение тела по модулю равно диаметру? Ответ дайте в метрах и округлите до сотых.","9,42","1","2022-09-08 08:01:02",,
"13","На рисунке представлен график зависимости скорости тела от времени. Определите путь, пройденный телом за первую секунду движения. Ответ дайте в м.","5","1","2022-10-13 20:01:01",,"https://ons.ort.ru/botphizika/teacher/uploads/1662447350.jpg"
"14","На рисунке представлен график зависимости скорости тела от времени. Определите путь, пройденный телом за первые три секунды движения.","25","1","2022-09-09 20:01:01",,"https://ons.ort.ru/botphizika/teacher/uploads/1662447396.jpg"
"15","На рисунке представлен график зависимости пути, пройденного телом, от времени. Определите скорость тела в интервале от 3 до 5 с. Ответ дайте в м/c.","2,5","1","2022-09-30 20:01:00",,"https://ons.ort.ru/botphizika/teacher/uploads/1662447603.jpg"
"16","Скорость моторной лодки относительно воды 40 км/ч, а скорость течения реки 4 км/ч. Лодка проходит 6 км по течению реки, а затем возвращается в обратно. Каково всё время движения лодки? Ответ дайте в минутах и округлите до целых.","18","1","2022-09-09 08:01:01",,
"17","Температура куска металла с удельной теплоёмкостью 900 Дж/(кг∙°С) понизилась со 120 °С до 30 °С. При этом выделилось количество теплоты, равное 121,5 кДж. Чему равна масса этого куска металла? Дайте ответ в кг.","1,5","2","2022-09-19 20:01:01",,
"18","В цилиндре под поршнем находилось твёрдое вещество. Цилиндр поставили в печь. Сначала цилиндр нагревали, а затем начали охлаждать. На рисунке схематично показан график изменения температуры вещества t от времени ԏ. Соотнесите процессы с участками графика AB, BC, CD, DE, EF. Ответ дайте в виде последовательности цифр без пробелов (например: 43152).

1 - кипение
2 - нагревание твёрдого вещества
3 - нагревание жидкости
4 - плавление
5 - нагревание пара
","24315","2","2022-09-14 20:01:01",,"https://ons.ort.ru/botphizika/teacher/uploads/1663059980.jpg"
"19","В цилиндре под поршнем находилось твёрдое вещество. Цилиндр поставили в печь. Сначала цилиндр нагревали, а затем начали охлаждать. На рисунке схематично показан график изменения температуры вещества t от времени ԏ. Соотнесите процессы с участками графика FG, GH, HK, KL, LM. Ответ дайте в виде последовательности цифр без пробелов (например: 43152).

1 - конденсация 
2 - кристаллизация
3 - охлаждение жидкости
4 - ожлаждение твёрдого тела
5 - охлаждение пара","51324","2","2022-09-15 20:01:01",,"https://ons.ort.ru/botphizika/teacher/uploads/1663060092.jpg"
"20","Определите, каким должно быть отношение масс медного и свинцового тел, чтобы при получении одного и того же количества теплоты они нагрелись на одно и то же количество градусов. Ответ округлите до сотых.
","0,34","2","2022-09-17 20:01:01",,"https://ons.ort.ru/botphizika/teacher/uploads/1663060851.jpg"
"21","Для твёрдого тела массой 2 кг имеется график зависимости температуры от отданного им количества теплоты. Какова удельная теплоёмкость вещества этого тела? Ответ дайте в единицах СИ.","1000","2","2022-09-26 20:01:01",,"https://ons.ort.ru/botphizika/teacher/uploads/1663061319.jpg"
"22","Зависимость температуры первоначально газообразного вещества от количества выделенной им теплоты показана на рисунке. Определите удельную теплоту парообразования данного вещества, если его масса составляет 3 кг. Ответ дайте в единицах СИ.","2000","2","2022-09-13 20:01:02",,"https://ons.ort.ru/botphizika/teacher/uploads/1663061881.jpg"
"23","Температура алюминиевой детали массой 1,5 кг увеличилась от 200 °С до 500 °С. Определите, какое количество энергии получила деталь. Ответ дайте в кДж.","405","2","2022-09-18 20:01:01",,"https://ons.ort.ru/botphizika/teacher/uploads/1663062203.jpg"
"24","Температура чугунного изделия уменьшилась на 600 °С. Определите, какое количество теплоты выделилось при этом, если масса изделия составляет 4,5 кг. Ответ дайте в кДж.","1350","2","2022-09-25 08:01:02",,"https://ons.ort.ru/botphizika/teacher/uploads/1663062353.jpg"
"25","Для определения удельной теплоёмкости вещества тело массой 350 г, нагретое до температуры 100 °С, опустили в калориметр, содержащий 200 г воды. Начальная температура калориметра с водой 23 °С. После установления теплового равновесия температура тела и воды стала равна 30 °С. Определите удельную теплоёмкость вещества исследуемого тела. Ответ дайте в единицах СИ. Теплоёмкость калориметра не учитывать.","240","2","2022-09-23 20:01:01",,"https://ons.ort.ru/botphizika/teacher/uploads/1663062845.jpg"
"26","Тело, нагретое до температуры 100 °С, опустили в калориметр, содержащий 150 г воды. Начальная температура калориметра с водой 15 °С. После установления теплового равновесия температура тела и воды стала равна 22 °С. Определите массу тела, если удельная теплоёмкость вещества, из которого оно сделано, равна 140 Дж/(кг∙К). Теплоёмкостью калориметра пренебречь. Ответ выразите в граммах, округлив до целых.","404","2","2022-09-28 08:01:00",,
"27","На рисунке представлен график зависимости проекции скорости тела от времени. Определите проекцию ускорения тела в интервале времени от 5 до 10 с.","-2,5","1","2022-09-16 08:01:01",,"https://ons.ort.ru/botphizika/teacher/uploads/1663063444.jpg"
"28","Кусок льда опустили в термос с водой. Начальная температура льда 0 °C. Начальная температура воды 30 °C. Теплоёмкостью термоса можно пренебречь. При переходе к тепловому равновесию часть льда массой 210 г растаяла. Чему равна исходная масса воды в термосе? Ответ выразите в граммах.","550","2","2022-09-16 20:01:01",,"https://ons.ort.ru/botphizika/teacher/uploads/1663063745.jpg"
"29","На рисунке представлен график зависимости пути, пройденного материальной точкой, от времени. Определите модуль скорости точки в интервале от 1 до 2 с. Ответ дайте в м/c.","2,5","1","2022-10-24 20:01:00",,"https://ons.ort.ru/botphizika/teacher/uploads/1663063942.jpg"
"30","На рисунке показан график зависимости температуры кристаллического вещества от времени его нагревания. Каждую минуту к веществу подводят 3 кДж теплоты. Какое количество теплоты нужно сообщить веществу, нагретому до температуры плавления, чтобы его полностью расплавить? Ответ дайте в кДж.","30","2","2022-09-22 08:01:01",,"https://ons.ort.ru/botphizika/teacher/uploads/1663064237.jpg"
"31","На рисунке приведён график зависимости проекции скорости тела от времени. Определите путь, пройденный телом в интервале от 10 до 15 с. Ответ дайте в метрах.","50","1","2022-10-03 08:01:02",,"https://ons.ort.ru/botphizika/teacher/uploads/1663064370.jpg"
"32","На рисунке показана зависимость координаты тела от времени. Определите максимальное значение модуля мгновенной скорости.","3","1","2022-10-06 08:01:02",,"https://ons.ort.ru/botphizika/teacher/uploads/1663064711.jfif"
"33","На рисунке показана зависимость координаты тела от времени. Определите среднюю скорость тела за первые 8 секунд движения. Ответ дайте в СИ.","1,5","1","2022-09-20 08:01:00",,"https://ons.ort.ru/botphizika/teacher/uploads/1663064832.jfif"
"34","Зависимость координаты материальной точки от времени в системе СИ выражается законом: x = - 8t + t^2. В какой момент скорость точки равна нулю? Ответ дайте в секундах.","4","1","2022-09-24 20:01:02",,
"35","Проекции скорости материальной точки на оси ОX и OY изменяются согласно уравнениям:
Vx = -5 + 3t
Vy = 4t

Чему равен модуль ускорения точки в м/c^2?","5","1","2022-09-15 08:01:01",,
"36","Координата тела, движущегося вдоль оси ОX, изменяется по закону x = 8 + 3t - 2t^2. Все величины выражены в СИ. Определите проекцию скорости тела на ось ОХ в момент времени 3 с.","-9","1","2022-09-19 08:01:01",,
"37","Определите начальную скорость тела, брошенного вертикально вниз, если в момент падения оно имеет скорость 25 м/с. Время падения составило 2 с. Ускорение свободного падения принять равным 10 м/с^2. Ответ дайте в м/с.","5","1","2022-09-18 08:01:01",,
"38","Тело брошено вертикально вверх с начальной скоростью 5 м/с. Через какое время оно достигнет максимальной высоты? Ответ запишите в СИ, округлив до десятых.","0,5","1","2022-09-14 08:01:01",,
"39","Необходимо экспериментально изучить зависимость выталкивающей силы, действующей на тело, погружённое в жидкость, от плотности жидкости. Какие две установки следует использовать для проведения такого исследования? В ответе запишите две цифры. ","15","3","2022-10-01 08:01:01",,"https://ons.ort.ru/botphizika/teacher/uploads/1663662508.jpg"
"40","Тело массой m и объёмом V плавает, частично погрузившись в жидкость плотностью ρ. Установите соответствие между физическими величинами и формулами, по которым их можно рассчитать. В ответе запишите две цифры.
А) модуль действующей на тело выталкивающей силы
Б) объём погруженной части тела

1 - ρgh
2 - mg
3 - ρgV
4 - m/ρ","24","3","2022-09-21 08:01:01",,
"41","Открытый сосуд с подсолнечным маслом находится при нормальном атмосферном давлении. Определите давление в сосуде на глубине 1,4 м. Ответ выразите в килопаскалях (кПа). Нормальное атмосферное давление примите равным 10^5 Па, g = 10 м/с^2.","112,6","3","2022-10-05 08:01:01",,"https://ons.ort.ru/botphizika/teacher/uploads/1663663162.jpg"
"42","Необходимо экспериментально установить наличие зависимости давления в жидкости от глубины погружения в неё. Для измерения давления используется маленький датчик, который при помощи длинного прямого щупа можно погружать в разные сосуды с разными жидкостями. Результаты измерения давления фиксируются при помощи электронного манометра, соединённого с датчиком.

Какие два эксперимента следует провести для установления указанной зависимости? В ответе запишите номера экспериментов.","12","3","2022-10-03 20:01:01",,"https://ons.ort.ru/botphizika/teacher/uploads/1663663364.jpg"
"43","Необходимо экспериментально установить наличие зависимости давления в жидкости от плотности жидкости.  Для измерения давления используется маленький датчик, который при помощи длинного прямого щупа можно погружать в разные сосуды с разными жидкостями. Результаты измерения давления фиксируются при помощи электронного манометра, соединённого с датчиком.

Какие два эксперимента следует провести для установления указанной зависимости? В ответе запишите номера экспериментов слитно без пробела.","13","3","2022-09-30 08:01:00",,"https://ons.ort.ru/botphizika/teacher/uploads/1663663433.jpg"
"44","В сосуд высотой 1,5 м налита некая жидкость, уровень которой ниже края сосуда на 10 см. Давление жидкости на дно сосуда — 15 кПа. Определите плотность жидкости в СИ, округлив ответ до целых. 

Атмосферное давление не учитывать. Ускорение свободного падения принять равным 10 м/с^2.","1071","3","2022-10-02 08:01:01",,
"45","Рассчитайте глубину озера, если максимальное давление, оказываемое на дно при нормальном атмосферном давлении составляет 3*10^5 Па? Ответ дайте в CИ. ","20","3","2022-09-28 20:01:01",,"https://ons.ort.ru/botphizika/teacher/uploads/1663663738.jpg"
"46","В каком из сосудов давление на дно максимально?","3","3","2022-09-25 20:01:01",,"https://ons.ort.ru/botphizika/teacher/uploads/1663663906.png"
"47","В каком из сосудов сила гидростатического давления на дно максимальна?","4","3","2022-09-27 08:01:02",,"https://ons.ort.ru/botphizika/teacher/uploads/1663664000.png"
"48","Из приведённых графиков выберите тот, который отображает зависимость модуля скорости материальной точки от времени при торможении с постоянным ускорением.","1","1","2022-10-18 20:01:01",,"https://ons.ort.ru/botphizika/teacher/uploads/1663664482.png"
"49","Из приведённых графиков выберите тот, который отображает зависимость высоты столба жидкости от ее плотности в сообщающихся сосудах, в которые налиты две жидкости с разной плотностью.","5","3","2022-09-24 08:01:02",,"https://ons.ort.ru/botphizika/teacher/uploads/1663664557.png"
"50","Из приведённых графиков выберите тот, который отображает зависимость модуля ускорения тела от времени при равноускоренном движении."," 3","1","2022-09-27 20:01:01",,"https://ons.ort.ru/botphizika/teacher/uploads/1663664797.png"
"51","Из приведённых графиков выберите тот, который отображает зависимость проекции скорости Vx материальной точки от времени при равномерном движении против оси Х.","1","1","2022-09-21 20:01:01",,"https://ons.ort.ru/botphizika/teacher/uploads/1663664892.png"
"52","Из приведённых графиков выберите тот, который будет отображать зависимость пути от времени при равноускоренном движении.","2","1","2022-10-08 20:01:01",,"https://ons.ort.ru/botphizika/teacher/uploads/1663664978.png"
"53","Из приведённых графиков выберите тот, который отображает зависимость модуля перемещения тела от времени при прямолинейном равномерном движении.","5","1","2022-09-26 08:01:01",,"https://ons.ort.ru/botphizika/teacher/uploads/1663665084.png"
"54","Из приведённых графиков выберите тот, который отображает зависимость силы Архимеда от плотности жидкости.","4","3","2022-09-22 20:01:01",,"https://ons.ort.ru/botphizika/teacher/uploads/1663665199.png"
"55","Из приведённых графиков выберите тот, который отображает зависимость силы Архимеда, действующей на тело, от объёма погруженной части тела.","4","3","2022-09-29 08:01:00",,"https://ons.ort.ru/botphizika/teacher/uploads/1663665256.png"
"56","Из приведённых графиков выберите тот, который отображает зависимость модуля перемещения материальной точки от времени при прямолинейном равноускоренном движении из состояния покоя.","2","1","2022-09-23 08:01:01",,"https://ons.ort.ru/botphizika/teacher/uploads/1663665324.png"
"57","Из приведённых графиков выберите тот, который отображает зависимость температуры тела, взятого при температуре плавления, от времени прохождения процесса плавления.","3","2","2022-09-20 20:01:01",,"https://ons.ort.ru/botphizika/teacher/uploads/1663665408.png"
"58","Из приведённых графиков выберите тот, который отображает зависимость проекции скорости тела, брошенного вертикально вверх, от времени в начале подъёма.","1","1","2022-10-14 08:01:01",,"https://ons.ort.ru/botphizika/teacher/uploads/1663665574.png"
"59","Из приведённых графиков выберите тот, который отображает зависимость давления, оказываемого на опору, от площади опоры.","2","3","2022-10-08 08:01:02",,"https://ons.ort.ru/botphizika/teacher/uploads/1663665648.png"
