"id","text","answer","category_id","timesend","bonus","img"
"60","На графике представлена зависимость скорости автомобиля от времени при движении по прямолинейной улице. Чему равен максимальный модуль ускорения? Ответ выразите в метрах на секунду в квадрате.","1","1","2022-10-15 08:01:01",,"https://ons.ort.ru/botphizika/teacher/uploads/1663665916.png"
"61","На графике представлена зависимость скорости автомобиля от времени при движении по прямолинейной улице. Чему равен минимальный модуль ускорения? Ответ выразите в метрах на секунду в квадрате.","0,25","1","2022-10-16 08:01:02",,"https://ons.ort.ru/botphizika/teacher/uploads/1663665965.png"
"63","На графике представлена зависимость скорости автомобиля от времени при движении по прямолинейной улице. Определите проекцию ускорения в интервале времени от 40 до 60 с. Ответ выразите в метрах на секунду в квадрате.","-0,5","1","2022-10-23 20:01:01",,"https://ons.ort.ru/botphizika/teacher/uploads/1663666052.png"
"64","На рисунке представлен график зависимости модуля скорости автомобиля от времени. Определите путь, пройденный автомобилем за первую секунду движения. Ответ дайте в СИ.","5","1","2022-10-11 20:01:01",,"https://ons.ort.ru/botphizika/teacher/uploads/1663666528.jpg"
"65","На рисунке представлен график зависимости модуля сокрости автомобиля от времени. Определите путь, пройденный автомобилем за две последние секунды движения. Ответ дайте в СИ.","10","1","2022-10-01 20:01:01",,"https://ons.ort.ru/botphizika/teacher/uploads/1663666564.jpg"
"66","На рисунке представлен график зависимости модуля сокрости автомобиля от времени. Определите путь, пройденный автомобилем за всё время движения. Ответ дайте в СИ.","35","1","2022-09-28 20:38:54",,"https://ons.ort.ru/botphizika/teacher/uploads/1663666602.jpg"
"67","На рисунке представлен график зависимости модуля скорости автомобиля от времени. Определите ускорение тела в первую секунду. Ответ дайте в СИ.","10","1","2022-10-18 08:01:01",,"https://ons.ort.ru/botphizika/teacher/uploads/1663666631.jpg"
"68","Тело брошено под углом α к горизонту с горизонтальной поверхности Земли со скоростью v. Оно поднимается на максимальную высоту h над земной поверхностью, а затем падает на землю. Установите соответствие между физическими величинами и формулами, по которым их можно определить. Ответ дайте в виде последовательности трёх цифр.

а) максимальная дальность полёта
б) максимальная высота подъёма
в) модуль горизонтальной проекции скорости тела в верхней точке траектории","314","1","2022-10-04 20:01:00",,"https://ons.ort.ru/botphizika/teacher/uploads/1664701134.jpg"
"69","Спортсмен поднимает вверх гирю массой 10 кг, действуя на неё с постоянной силой 130 Н, направленной вертикально вверх. Чему равна равнодействующая сил, действующих на гирю? Ответ дайте в СИ.","30","4","2022-10-07 08:01:01",,
"70","Спортсмен поднимает вверх гирю массой 10 кг, действуя на неё с силой 130 Н. Чему равно ускорение гири? Ответ дайте в СИ.","3","4","2022-10-05 20:01:00",,
"71","Скорость тела массой 0,5 кг равна 3 м/с. Какова его кинетическая энергия? Ответ дайте в Джоулях.","2,25","4","2022-10-04 08:01:01",,
"72","Кинетическая энергия тела составляет 18 Дж, если тело движется со скоростью 3 м/с. Какова масса тела в кг?","4","4","2022-10-02 20:01:01",,
"73","На рисунке показан график зависимости координаты тела, движущегося вдоль оси x, от времени t. Установите соответствия между графиками А, Б и физическими величинами, зависимости которых они могут представлять. Ответ дайте в виде двух цифр.

1) проекция ускорения тела на ось x
2) кинетическая энергия тела
3) проекция скорости на ось x
4) модуль ускорения тела
5) модуль импульса тела","23","1","2022-10-10 20:01:02",,"https://ons.ort.ru/botphizika/teacher/uploads/1664903957.png"
"74","Одной и той же жидкостью заполнили три сосуда разной формы. В каком соотношении находятся давления на дно сосудов?

1) P1 > P3 > P2
2) P1 = P3 > P2
3) P1 = P2 = P3
4) P1 = P3 < P2
5) P1 > P2 > P3","3","3","2022-10-09 08:01:02",,"https://ons.ort.ru/botphizika/teacher/uploads/1664904170.png"
"75","Две материальные точки начинают движение из начала отсчёта вдоль оси OX в противоположных направлениях. На графике изображены зависимости проекций их скоростей Vx от времени t. Чему будет равно расстояние между точками через 4 с после начала движения? Ответ дайте в метрах.","10","1","2022-10-17 20:01:01",,"https://ons.ort.ru/botphizika/teacher/uploads/1664904514.jpg"
"76","Два мотоцикла движутся навстречу друг другу. Зависимость расстояния между ними от времени отображена на графике. Определите скорость движения первого мотоцикла, если второй движется со скоростью 25 м/c. Ответ дайте в СИ.
","15","1","2022-10-14 20:01:01",,"https://ons.ort.ru/botphizika/teacher/uploads/1664904853.jpg"
"77","Два мотоцикла движутся навстречу друг другу. Зависимость расстояния между ними от времени отображена на графике. Определите скорость движения первого мотоцикла в системе отсчёта, связанной со вторым мотоциклом. Ответ дайте в км/ч.","144","1","2022-10-21 20:01:01",,"https://ons.ort.ru/botphizika/teacher/uploads/1664904937.jpg"
"78","Деревянный кубик имеет ребро 2 см. Определите архимедову силу, действующую на этот кубик при полном погружении в воду. Ответ дайте в ньютонах.","0,08","3","2022-10-06 20:01:01",,"https://ons.ort.ru/botphizika/teacher/uploads/1664905273.jpg"
"79","Из окна со скоростью 10 м/с была горизонтально брошена монета. Дальность полета полёта монеты оказалась равна высоте бросания. Определите время полёта монеты в секундах.","2","1","2022-10-16 20:01:00",,
"80","С отвесной скалы со скоростью 15 м/с был горизонтально брошен камень. Дальность полета камня оказалась равна высоте бросания. Определите высоту скалы в метрах.","45","1","2022-10-07 20:01:00",,
"81","В какой ситуации сила, действующая со стороны воды на кубик, будет максимальной? Если кубик касается дна или стенки сосуда, вода под него не подтекает.","4","3","2022-10-11 08:01:00",,"https://ons.ort.ru/botphizika/teacher/uploads/1664907205.jpg"
"82","Радиус мяча составляет 10 см. Определите действующую на него выталкивающую силу, если в воду погружена треть его объёма. Ответ дайте в СИ, округлив до целых.","42","3","2022-10-10 08:01:02",,"https://ons.ort.ru/botphizika/teacher/uploads/1664907904.jpg"
"83","Автомобиль движется по закруглению дороги радиусом 20 м со скоростью 30 м/с. Определите его центростремительное ускорение. Ответ дайте в СИ.","45","1","2022-10-27 20:01:01",,
"84","Период обращения колёс робота-тележки составляет 0,75 с. Диаметр колеса равен 5 см. Рассчитайте линейную скорость точек обода колеса. Ответ дайте в СИ, округлив до сотых.","0,21","1","2022-10-17 08:01:01",,
"85","Материальная точка движется по окружности, радиус которой равен 4 м. Определите центростремительное ускорение точки в момент времени t=3 с, используя график зависимости скорости точки от времени. Ответ дайте в СИ.","9","1","2022-10-15 20:01:01",,"https://ons.ort.ru/botphizika/teacher/uploads/1665302960.png"
"86","Металлический шар подвешен на нити длиной 1,6 м. Шар отвели в сторону и отпустили. Нижнюю точку траектории он проходит со скоростью 2 м/с. Найдите центростремительное ускорение шара в этой точке в СИ. ","2,5","1","2022-10-19 20:01:01",,
"87","Материальная точка движется по окружности, центр которой расположен в начале координат. Зависимость координаты токи x от времени указана на графике. Определите угловую скорость точки в рад/с. Ответ округлите до сотых.","0,52","1","2022-10-26 20:01:00",,"https://ons.ort.ru/botphizika/teacher/uploads/1665303414.png"
"88","Груз, прикреплённый к пружине, совершает колебания вдоль оси х. Зависимость координаты от времени для груза указана на графике. Определите амплитуду колебаний груза в метрах.","0,04","1","2022-10-20 20:01:01",,"https://ons.ort.ru/botphizika/teacher/uploads/1665303534.png"
"89","Груз, прикреплённый к пружине, совершает колебания вдоль оси х. Зависимость координаты от времени для груза указана на графике. Определите проекцию скорости груза на ось x в момент времени 3 с. Ответ дайте в СИ, округлив до сотых.","-0,02","1","2022-10-22 20:01:01",,"https://ons.ort.ru/botphizika/teacher/uploads/1665303846.png"
"90","Математический маятник совершает малые колебания около положения равновесия вдоль оси x. Имеются графики зависимости координаты и проекции скорости от времени. Определите циклическую частоту колебаний маятника в рад/c.","20","1","2022-10-12 20:01:02",,"https://ons.ort.ru/botphizika/teacher/uploads/1665304129.png"
"91","Математический маятник совершает малые колебания около положения равновесия вдоль оси x. Имеются графики зависимости координаты и проекции скорости от времени. Определите период колебаний маятника в секундах.","0,314","1","2022-10-12 08:01:01",,"https://ons.ort.ru/botphizika/teacher/uploads/1665304243.png"
"92","Математический маятник совершает малые колебания около положения равновесия вдоль оси x. Имеются графики зависимости координаты и проекции скорости от времени. Определите максимальное ускорение маятника в СИ.","8","1","2022-10-09 20:01:01",,"https://ons.ort.ru/botphizika/teacher/uploads/1665304336.png"
"93","Радиус окружности, описываемой концом минутной стрелки, в 3 раза больше радиуса окружности, описываемой концом секундной стрелки механических часов. Чему равно отношение модуля вектора средней
скорости конца минутной стрелки к модулю вектора средней скорости конца секундной стрелки?","0,05","1","2022-10-13 08:01:01",,
"94","Первый искусственный спутник Земли, принадлежащий Эфиопии, имеет радиус орбиты 627 км. Он запущен в 2020 году и имеет имя ETRSS-1. Определите линейную скорость движения по орбите спутника ETRSS-1, если период его обращения равен 97 минут. Ответ дайте в СИ, округлив до целых.","677","1","2022-10-25 20:01:01",,"https://ons.ort.ru/botphizika/teacher/uploads/1665600475.jfif"
"95","Определите импульс автомобиля массой 1,5 т, движущегося со скоростью 72 км/ч. Ответ выразите в СИ.","30000","4","2022-10-21 08:01:01",,
"96","Определите импульс силы, если её значение равно 15 Н, а время действия составляет 0,5 мин. Ответ дайте в СИ.","450","4","2022-10-20 08:01:01",,
"97","Из приведённых графиков выберите тот, который соответствует зависимости кинетической энергии тела от его массы.","5","4","2022-10-19 08:01:01",,"https://ons.ort.ru/botphizika/teacher/uploads/1666117685.jpg"
"98","Из приведённых графиков выберите тот, который соответствует зависимости кинетической энергии тела от его скорости.","1","4","2022-10-25 08:01:01",,"https://ons.ort.ru/botphizika/teacher/uploads/1666117715.jpg"
"99","Будем считать Землю инерциальной системой отсчёта. Среди перечисленных систем отсчёта выберите те, которые можно считать инерциальными.

1) лифт, движущийся равноускоренно вверх
2) свободно падающее тело
3) равномерно и прямолинейно движущийся автобус
4) пароход, плывущий по реке равномерно и прямолинейно
5) лифт, движущийся равномерно вниз
6) дерево у дороги
7) берег реки

Ответ дайте в виде последовательности цифр.","34567","4","2022-10-22 08:01:01",,
"100","Под действием постоянной силы, равной 10 Н, тело движется прямолинейно. Зависимость координаты тела от времени описывается уравнением х = 8 - 5t - t^2. Какова масса тела?","20","4","2022-11-09 20:01:01",,
"101","Определите значение равнодействующей трёх сил, ответ дайте в СИ, округлив до десятых.","5,4","4","2022-10-28 08:01:01",,"https://ons.ort.ru/botphizika/teacher/uploads/1666431030.jpg"
"102","Определите модуль равнодействующей четырёх сил. Ответ дайте в СИ, округлив до целых.","5","4","2022-10-23 08:01:01",,"https://ons.ort.ru/botphizika/teacher/uploads/1666431240.jpg"
"103","Определите модуль равнодействующей двух сил. Ответ дайте в ньютонах.","30","4","2022-10-26 08:01:01",,"https://ons.ort.ru/botphizika/teacher/uploads/1666551517.jpg"
"104","Брусок массой M = 8 кг удерживается силой F при помощи невесомой и нерастяжимой нити, перекинутой через блок. Определите значение силы F. Трение не учитывать.","40","4","2022-11-10 08:01:00",,"https://ons.ort.ru/botphizika/teacher/uploads/1666552099.jpg"
"105","Определите ускорение бруска массой M = 3 кг, если F = 21 Н. Трение не учитывать. Ответ выразите в СИ.","2","4","2022-10-24 08:01:01",,"https://ons.ort.ru/botphizika/teacher/uploads/1666552288.jpg"
"106","На графике дана зависимость проекции скорости тела массой 2 кг от времени. Определите модуль силы, действующей на тело в интервале от 0 до 5 с. Ответ дайте в СИ.","10","4","2022-10-28 20:01:01",,"https://ons.ort.ru/botphizika/teacher/uploads/1666552550.jpg"
"107","На графике дана зависимость проекции скорости тела массой 2 кг от времени. Определите проекцию силы, действующей на тело в интервале от 0 до 5 с. Ответ дайте в СИ.","-10","4","2022-11-10 20:01:01",,"https://ons.ort.ru/botphizika/teacher/uploads/1666552614.jpg"
"108","На рисунке указаны векторы скорости и ускорения тела. Как направлена приложенная к телу сила?
1 - вправо
2 - влево
3 - вверх
4 - вниз
5 - она равна нулю
6 - нельзя сказать определённо","3","4","2022-11-09 08:01:00",,"https://ons.ort.ru/botphizika/teacher/uploads/1666552854.jpg"
"109","На рисунке указаны векторы ускорения тела и равнодействующей всех сил, действующих на тело. Как направлена скорость тела?
1 - вправо
2 - влево
3 - вверх
4 - вниз
5 - она равна нулю
6 - нельзя сказать определённо","6","4","2022-10-27 08:01:01",,"https://ons.ort.ru/botphizika/teacher/uploads/1666553002.jpg"
"110","Бусинка скользит по горизонтальной неподвижной спице. На рисунке изображена зависимость координаты X бусинки от времени. Выберите из списка все верные утверждения. Ответ дайте в виде последовательности цифр.
1 - участок 1 соответствует равноускоренному движению бусинки
2 - участок 2 соответствует равномерному движению бусинки
3 - проекция скорости бусинки на участке 1 положительна
4 - проекция скорости бусинки на участке 2 положительна
5 - проекция ускорения бусинки на участке 1 равна нулю
6 - проекция ускорения бусинки на участке 2 равна нулю","356","1","2022-11-05 20:01:01",,"https://ons.ort.ru/botphizika/teacher/uploads/1667314893.jpg"
"111","Температура медной детали массой 300 г изменилась от 20  до 80 градусов по Цельсию. Какое количество теплоты передано детали? Ответ дайте в СИ. Удельная теплоёмкость меди равна 380 Дж/(кг*С). ","6840","2","2022-11-08 08:01:01",,
"112","На какое количество земных радиусов должен удалиться космический корабль от поверхности Земли, чтобы действующая на него сила тяжести уменьшилась в четыре раза?","1","4","2022-11-06 20:01:00",,
"113","Космический корабль взлетел с поверхности Земли и удалился от неё на такое расстояние, что действующая на него сила тяжести уменьшилась в 36 раз. Выразите расстояние до корабля в радиусах Земли.","5","4","2022-11-15 08:01:02",,
"114","Во сколько раз изменится сила притяжения между двумя телами, если массу одного из них уменьшить вдвое, а расстояние между телами уменьшить втрое?","4,5","4","2022-11-11 08:01:01",,
"115","Определите ускорение свободного падения на планете Плюк,  радиус которой равен 6100 км, а средняя плотность составляет 5200 кг/м^3. Гравитационную постоянную принять равной 6,7x10^-11 Н x м^2/кг^2. Ответ выразите в СИ, округлив до десятых.","8,9","4","2022-11-07 20:01:01",,
"116","18 февраля 2021 года на поверхность Марса высадился марсоход Персеверанс, имеющий массу 1025 кг. Определите силу тяжести, действующую на марсоход, если ускорение свободного падения на Марсе составляет 3,7 м/c^2. Ответ выразите в кН, округлив до десятых.","3,8","4","2022-11-08 20:01:01",,"https://ons.ort.ru/botphizika/teacher/uploads/1667737465.jpg"
"117","На полу лифта, движущегося с ускорением 2 м/с^2, направленным вертикально вверх, стоит коробка массой 5 кг. Определите вес коробки в СИ. g = 10 м/с^2.","60","4","2022-11-14 08:01:02",,
"118","Пассажиры автомобиля, движущегося со скоростью 20 м/с по выпуклому мосту, почувствовали состояние невесомости, находясь в верхней точке моста. Определите радиус кривизны моста в метрах.","40","4","2022-11-11 20:01:00",,
"119","На сколько сантиметров сожмется пружина жёсткостью 10 кН/м, если на неё подействовать с силой 500 Н?","5","4","2022-11-12 08:01:02",,
"120","Горизонтальный диск вращается с некоторой угловой скоростью. Брусок, помещённый на диск, вращается вместе с диском с той же угловой скоростью без проскальзывания. В ходе опыта угловую скорость диска увеличивают, при этом положение бруска остаётся прежним. Как изменилось центростремительное ускорение бруска?
1 - увеличилось
2 - уменьшилось
3 - не изменилось","1","1","2022-11-13 20:01:01",,
